episode_id,source,source_url,current_persona_id,current_cluster_signature,candidate_source_pool,normalized_episode,business_question,bottleneck_text,desired_output,pain_codes,question_codes,output_codes,workflow_stage,analysis_goal,bottleneck_type,trust_validation_need,expansion_label,expansion_reason,expansion_confidence,manually_reviewed,reviewer_note,should_join_persona_04,should_remain_persona_01_parent,should_block_persona_04_expansion,hard_negative_subtype
adobe_analytics_community::12606::01,adobe_analytics_community,https://experienceleaguecommunities.adobe.com/adobe-analytics-3/analytics-community-lens-5th-edition-may-2023-12606,persona_01,primary=manual_reporting||secondary=metric_reconciliation|presentation_ready_output_need|recurring_export_work,curated_ambiguous_boundary,"Analytics Community Lens 5th Edition, May 2023 Welcome to the 5th edition of the Adobe Analytics Community Lens! Adobe Analytics Community Lens is your community bulletin board highlighting the latest updates from the Adobe Analytics Community in one place.In this edition, we are sharing updates from March and April 2023, including, the most viewed Adobe Analytics content on Experience League, as well as the latest product releases, upcoming and past learning opportunities, and a lot more! &nbsp; Adobe Analytics Community Lens&nbsp; &#128197;EVENTS AND OPPORTUNITIES&#128197; Adobe Analytics Champions Office Hours, May 17 Come join some of our Adobe Analytics champions as they answer your questions! RSVP here. &nbsp; Adobe Insider Tour Chicago, May 18 On Thursday, May 18, join us for an exclusive in-person experience made for innovators like yourself. This day will be filled with opportunities for you to expand your skills through interactive sessions, meet other experts, and learn more about how you can transform and reimagine your entire customer journey. Make sure to register today. Munch 'N Master: Adobe Analytics Scorecards Mobile App and Data Stories, May 31, 10:00 AM MDT You've heard of a lunch 'n learn.&nbsp; Welcome to the first in our series of User Group ""Munch 'N Master"" series where you get the opportunity to master new skills in the realm of Adobe Analytics! Join NOAM User Group, and RSVP here! &nbsp; Adobe Analytics EMEA Summit User Group Meeting, June 7 We are beyond excited to announce our very first in-person Adobe Analytics User Group Meeting in cooperation with the new DACH AUG. The meeting will happen on Wednesday, June 7th, just the day before EMEA Summit starts, from 3pm to 10pm UK time. Visit here to RSVP! Adobe Analytics EMEA 2023 Q2 Get-Together, June 14, 9:00 AM MDT This is a chance for us all to get together for an informal session to celebrate product releases and share our different experiences using Adobe Analytics throughout the year; positive or negative. We'll be breaking out into smaller breakout rooms, so if comfortable, please do come prepared with some thoughts from your own organization to share. RSVP here!&nbsp; &#9889;TIPS &amp; TRICKS | BEST PRACTICES&#9889; Hear from Adobe product leaders and practitioners and enhance your product knowledge with their expert insights: Transitioning from Reports &amp; Analytics to Adobe Workspace How Do You Start Reporting on Your Media Data Why should brands need to move to AEP Web SDK from traditional Appmeasurement.js? Sample SQL queries to query Adobe analytics Data feeds &nbsp; &#128204;TOP VIEWED EXPERIENCE LEAGUE CONTENT&#128204; Check out where your peers are spending most of their time learning in the Community and follow the conversations that pique your interest: Most Viewed Community Discussions in April ‘23 [On-demand Webinar] Building a team of Adobe Analytics Experts Adobe Analytics Resources [AA Community Q&amp;A Coffee Break] 04/05/23, 10am PT: Come ask questions on analytics, best practices, and tips &amp; tricks with Ben Gaines, Director of Product Management for Adobe Analytics What is the difference between Entry Pages &amp; Original Entry Pages? Marketing Channel Rule for Natural Search &nbsp; Most Viewed Community Q&amp;A&nbsp;in April ‘23 postman authentication failed with error 'Error: getaddrinfo ENOTFOUND ims-na1.adobelogin.com'. Adobe Analytics Alerts Difference between Visit and Hit Adobe Analytics will support Apple TV JWT access token: How can I change the expiration? &nbsp; Most Viewed Community Ideas in April ‘23 Multiple Dimensions columns in Adobe Workspace Make 'Previous Page' &amp; 'Next Page' Dimensions in Workspace Metric Filters Using calculated metrics on Data Warehouse Rolling Daily/Monthly/Yearly Active User Metrics + User stickiness metrics (i.e. MAU/YAU) &nbsp; &nbsp; &#128262;CONTRIBUTOR SPOTLIGHT&#128262; We are so happy to be focusing this month’s spotlight on Frederik Werner! Frederik works as Solution Architect for Accutics, based in Germany. As a highly decorated industry expert, he has successfully implemented digital analytics systems and strategies in companies of all shapes and sizes, regularly sharing his experiences on many events and conferences, as well as on the award-nominated blog https://www.fullstackanalyst.io/. Frederik’s LinkedIn can be found here. &nbsp; &nbsp; “Wisdom is not a product of schooling but of the lifelong attempt to acquire it.” ― Albert Einstein &nbsp; We encourage and value all your feedback! Please feel free to share your thoughts and suggestions for how we might improve this Adobe Campaign Community Lens update and if there is any other information that you would like to see included here:&nbsp;Experience League Community Lens Feedback ------------------------------------------------------------------------------------------------------------------------------------ Meet your Community Manager Hello! I’m Sean, your Community Manager for the Adobe Analytics Community. I’m here to help you with your queries, feedback, or any kind of assistance required in understanding and interacting with the community. Please feel free to reach out to me:&nbsp;seanrobinson &nbsp;",How can we deliver recurring reporting output faster and with fewer manual steps?,general_friction,xlsx_report,P_DATA_QUALITY,Q_REPORT_SPEED,O_XLSX|O_VALIDATED_DATASET,reporting,report_speed,data_quality,medium,expansion_ambiguous_do_not_anchor,mixed report_speed and validation cues create a boundary case between reporting-packager and reconciliation personas,medium_high,True,Boundary row retained to test do-not-anchor behavior during expansion.,False,False,False,
adobe_analytics_community::12621::01,adobe_analytics_community,https://experienceleaguecommunities.adobe.com/adobe-analytics-3/review-across-report-suites-to-ensure-optimal-aa-performance-12621,persona_01,primary=manual_reporting||secondary=presentation_ready_output_need|recurring_export_work|tool_limitation_workaround,curated_ambiguous_boundary,"Review Across Report Suites to Ensure Optimal AA Performance Governance Component Where to Find Reason for Revision System Admins Navigate to Admin Console &gt; Users &gt; Administrators. &nbsp; &nbsp; Identify the number of System Admins for your organization. It is not recommended is to have more than 4-5 system admins. Product Profiles with Zero Users/Permissions Navigate to Admin Console &gt; Products &gt; Analytics &gt; Product Profiles &gt; Permissions. &nbsp; Identify the user profiles that do not contain any permissions or profiles that do not include any users. Remove these user profiles. Data Governance Settings Navigate to Analytics &gt; Admin &gt; Data Governance. &nbsp; Identify if the implementation includes labels across AA data. If not, consider adding these labels to help your AA users more efficiently identify the components they need for reporting. Segment Sharing Permissions &nbsp; Navigate to Adobe Analytics &gt; Admin Console. Identify if Segment Sharing permissions are enabled for all AA users. As there is a limit on number of segments that can be shared to the Experience Cloud, permission should not be given to every user, otherwise there is the risk that the segment sharing will reach its capacity. &nbsp; Inactive Report Suites &nbsp; Navigate to Analytics &gt; Admin &gt; Report Suites to view all configured Report Suites. Identify which report suites are still visible in the AA UI but contain little to no data. It is suggested to hide report suites, as they cannot be deleted, from the UI if they are not used. Performance Component Where to Find Reason for Revision Traffic Settings Navigate to Analytics &gt; Admin &gt; Report Suites, pick the Global report suite (or most prevalent), then Edit Settings &gt; Traffic Management &gt; Permanent traffic. Identify if permanent traffic is set. Check that the permanent traffic number matches the number of server calls that your organization currently has configured for the selected report suite. You can change expected traffic levels so Adobe can reassign resources to handle the new traffic level. Otherwise, you can&nbsp;schedule a traffic spike&nbsp;if you want to temporarily reassign resources. &nbsp; Data Feeds Navigate to Analytics &gt; Admin &gt; Data Feeds and see if there is more than one feed set up for each report suite. Identify the number of data feeds configured. It is not advised to have more than one feed per report suite, as all data should be sent into a single location and then dispersed internally. Settings Component Where to Find Reason for Revision Internal URL Filters Navigate to Analytics &gt; Admin &gt; Report Suites, pick the Global report suite (or most prevalent), then Edit Settings &gt;General &gt; Internal URL filters. &nbsp; Excessive filters may skew data if they are not necessary/ appropriate. Check if your implementation has set internal URLs that should not be classified as external traffic. Marketing Channels Navigate to Analytics &gt; Admin &gt; Report Suites, pick the Global report suite (or most prevalent), then Edit Settings &gt;Marketing Channels &gt;Marketing Channels Processing Rules. Order/hierarchy is crucial for Marketing Channels. Make sure your channels follow a logical and appropriate order. See more information on Marketing Channels order here. Privacy Reporting Navigate to Analytics &gt; Admin &gt; Report Suites, pick the Global report suite (or most prevalent), then Edit Settings &gt;Privacy Management &gt; Privacy Reporting. Check if the implementation is leveraging consent managers and/or the Privacy API. Enabling these OOTB variables will help to identify the number of users that are opting out of data collection, which may be valuable in your reporting. Bot Rules Navigate to Analytics &gt; Admin &gt; Report Suites, pick the Global report suite (or most prevalent), then Edit Settings &gt;General &gt; Bot Rules. At a minimum, the IAB bot filtering rules should be enabled. Selecting Enable IAB Bot Filtering Rules uses the&nbsp;IAB’s&nbsp;(International Advertising Bureau’s) International Spiders &amp; Bots List to remove bot traffic.&nbsp; Implementation Strategy Component Where to Find Reason for Revision Variable Descriptions Navigate to Analytics &gt; Admin &gt; Report Suites, pick the Global report suite (or most prevalent), then Edit Settings &gt; Conversion &gt; Conversion variables. Identify if variable descriptions are included across description fields for conversion variables (eVars), traffic variables (props), and events to ensure AA users are leveraging the appropriate variables for reporting. Multi-suite Tagging Navigate to Analytics &gt; Admin &gt; Server call usage &gt; Report Suite Usage. Identify if your organization has any secondary server call volume. Since the inception of Virtual Report Suites, SSCs are not needed for most use cases. Library Version Leverage the Experience Cloud Debugger to check the appMeasurement version in use. Identify the implementation’s appMeasurement version and check if there is a newer version available. If there is a newer version, you may want to consider upgrading. &nbsp; Governance Component Where to Find Reason for Revision System Admins Navigate to Admin Console &gt; Users &gt; Administrators. &nbsp; &nbsp; Identify the number of System Admins for your organization. It is not recommended is to have more than 4-5 system admins. Product Profiles with Zero Users/Permissions Navigate to Admin Console &gt; Products &gt; Analytics &gt; Product Profiles &gt; Permissions. &nbsp; Identify the user profiles that do not contain any permissions or profiles that do not include any users. Remove these user profiles. Data Governance Settings Navigate to Analytics &gt; Admin &gt; Data Governance. &nbsp; Identify if the implementation includes labels across AA data. If not, consider adding these labels to help your AA users more efficiently identify the components they need for reporting. Segment Sharing Permissions &nbsp; Navigate to Adobe Analytics &gt; Admin Console. Identify if Segment Sharing permissions are enabled for all AA users. As there is a limit on number of segments that can be shared to the Experience Cloud, permission should not be given to every user, otherwise there is the risk that the segment sharing will reach its capacity. &nbsp; Inactive Report Suites &nbsp; Navigate to Analytics &gt; Admin &gt; Report Suites to view all configured Report Suites. Identify which report suites are still visible in the AA UI but contain little to no data. It is suggested to hide report suites, as they cannot be deleted, from the UI if they are not used. Performance Component Where to Find Reason for Revision Traffic Settings Navigate to Analytics &gt; Admin &gt; Report Suites, pick the Global report suite (or most prevalent), then Edit Settings &gt; Traffic Management &gt; Permanent traffic. Identify if permanent traffic is set. Check that the permanent traffic number matches the number of server calls that your organization currently has configured for the selected report suite. You can change expected traffic levels so Adobe can reassign resources to handle the new traffic level. Otherwise, you can&nbsp;schedule a traffic spike&nbsp;if you want to temporarily reassign resources. &nbsp; Data Feeds Navigate to Analytics &gt; Admin &gt; Data Feeds and see if there is more than one feed set up for each report suite. Identify the number of data feeds configured. It is not advised to have more than one feed per report suite, as all data should be sent into a single location and then dispersed internally. Settings Component Where to Find Reason for Revision Internal URL Filters Navigate to Analytics &gt; Admin &gt; Report Suites, pick the Global report suite (or most prevalent), then Edit Settings &gt;General &gt; Internal URL filters. &nbsp; Excessive filters may skew data if they are not necessary/ appropriate. Check if your implementation has set internal URLs that should not be classified as external traffic. Marketing Channels Navigate to Analytics &gt; Admin &gt; Report Suites, pick the Global report suite (or most prevalent), then Edit Settings &gt;Marketing Channels &gt;Marketing Channels Processing Rules. Order/hierarchy is crucial for Marketing Channels. Make sure your channels follow a logical and appropriate order. See more information on Marketing Channels order here. Privacy Reporting Navigate to Analytics &gt; Admin &gt; Report Suites, pick the Global report suite (or most prevalent), then Edit Settings &gt;Privacy Management &gt; Privacy Reporting. Check if the implementation is leveraging consent managers and/or the Privacy API. Enabling these OOTB variables will help to identify the number of users that are opting out of data collection, which may be valuable in your reporting. Bot Rules Navigate to Analytics &gt; Admin &gt; Report Suites, pick the Global report suite (or most prevalent), then Edit Settings &gt;General &gt; Bot Rules. At a minimum, the IAB bot filtering rules should be enabled. Selecting Enable IAB Bot Filtering Rules uses the&nbsp;IAB’s&nbsp;(International Advertising Bureau’s) International Spiders &amp; Bots List to remove bot traffic.&nbsp; Implementation Strategy Component Where to Find Reason for Revision Variable Descriptions Navigate to Analytics &gt; Admin &gt; Report Suites, pick the Global report suite (or most prevalent), then Edit Settings &gt; Conversion &gt; Conversion variables. Identify if variable descriptions are included across description fields for conversion variables (eVars), traffic variables (props), and events to ensure AA users are leveraging the appropriate variables for reporting. Multi-suite Tagging Navigate to Analytics &gt; Admin &gt; Server call usage &gt; Report Suite Usage. Identify if your organization has any secondary server call volume. Since the inception of Virtual Report Suites, SSCs are not needed for most use cases. Library Version Leverage the Experience Cloud Debugger to check the appMeasurement version in use. Identify the implementation’s appMeasurement version and check if there is a newer version available. If there is a newer version, you may want to consider upgrading. &nbsp;",How can we deliver recurring reporting output faster and with fewer manual steps?,tool_limitation,xlsx_report,P_DATA_QUALITY|P_TOOL_LIMITATION,Q_REPORT_SPEED|Q_DIAGNOSE_ISSUE,O_XLSX|O_VALIDATED_DATASET,reporting,report_speed,data_quality,medium,expansion_ambiguous_do_not_anchor,mixed report_speed and validation cues create a boundary case between reporting-packager and reconciliation personas,medium_high,True,Boundary row retained to test do-not-anchor behavior during expansion.,False,False,False,
domo_community_forum::46722::01,domo_community_forum,https://community-forums.domo.com/main/discussion/46722/how-to-hide-results-in-dashboard-when-user-number-are-small,persona_01,primary=manual_reporting||secondary=presentation_ready_output_need|recurring_export_work|spreadsheet_rework,curated_ambiguous_boundary,"how to hide results in dashboard when user number are small I have a dashboard that contains some user information such as # of users, user activity(downloads, views etc), I have different filters set up to allow stakeholders to filter on user region, user group etc. However, due to the data privacy, I could not report on some info when # of user <20. here is what I hope to do:… I have a dashboard that contains some user information such as # of users, user activity(downloads, views etc), I have different filters set up to allow stakeholders to filter on user region, user group etc. However, due to the data privacy, I could not report on some info when # of user <20. here is what I hope to do:…",How can we deliver recurring reporting output faster and with fewer manual steps?,handoff_friction,xlsx_report,P_HANDOFF,Q_REPORT_SPEED,O_XLSX|O_DASHBOARD,reporting,report_speed,handoff_dependency,unassigned,expansion_ambiguous_do_not_anchor,mixed report_speed and validation cues create a boundary case between reporting-packager and reconciliation personas,medium_high,True,Boundary row retained to test do-not-anchor behavior during expansion.,False,False,False,
domo_community_forum::51444::01,domo_community_forum,https://community-forums.domo.com/main/discussion/51444/google-ads-data-discrepancy-between-api-reports,persona_01,primary=manual_reporting||secondary=recurring_export_work,curated_ambiguous_boundary,"Google Ads Data Discrepancy Between API Reports There are several reports you can bring into Domo through the API scripting to Google Sheets then have the Google Sheets Connector pull in the data. I have set up this process in our instance and it has been working perfectly for several months. The trouble I find is between reports such as Geo Performance, Ad Performance,… There are several reports you can bring into Domo through the API scripting to Google Sheets then have the Google Sheets Connector pull in the data. I have set up this process in our instance and it has been working perfectly for several months. The trouble I find is between reports such as Geo Performance, Ad Performance,…",How can we deliver recurring reporting output faster and with fewer manual steps?,general_friction,xlsx_report,P_MANUAL_REPORTING,Q_REPORT_SPEED,O_XLSX,reporting,report_speed,manual_reporting,unassigned,expansion_ambiguous_do_not_anchor,mixed report_speed and validation cues create a boundary case between reporting-packager and reconciliation personas,medium_high,True,Boundary row retained to test do-not-anchor behavior during expansion.,False,False,False,
