episode_id,source,source_url,current_persona_id,current_cluster_signature,candidate_source_pool,normalized_episode,business_question,bottleneck_text,desired_output,pain_codes,question_codes,output_codes,workflow_stage,analysis_goal,bottleneck_type,trust_validation_need,expansion_label,expansion_reason,expansion_confidence,manually_reviewed,reviewer_note,should_join_persona_04,should_remain_persona_01_parent,should_block_persona_04_expansion,hard_negative_subtype
google_developer_forums::103469::01,google_developer_forums,https://discuss.google.dev/t/google-analytics-4-raw-data-export-to-gcs-is-approach-valid/103469,persona_01,primary=manual_reporting||secondary=recurring_export_work|spreadsheet_rework,curated_hard_negative,"Google Analytics 4 RAW Data Export to GCS. Is Approach valid? Hi, Goal: To export Google Analytics 4 events data to the GCS bucket on daily basis. Approach: Exporting Table Data to BigQuery Example: EXPORT DATA OPTIONS ( uri = 'gs://bucket/folder/*.csv', format = 'CSV', overwrite = true, header = true, field_delimiter = ';') AS ( SELECT field1, field2 FROM mydataset.table1 ORDER BY field1 ); , as the GA data is nested the file format would be either Parquet or Avro. Problem: As per the official document of [GA4] BigQuery Export schema, In the events table, “ Not all devices on which events are triggered send their data to Analytics on the same day the events are triggered. To account for this latency, Analytics will update the daily tables (events_YYYYMMDD) with events for those dates for up to three days after the dates of the events. Events will have the correct time stamp regardless of arriving late. Events that arrive after that three-day window are not recorded” I’ve checked the same in our analytics dataset - for today i.e 15th Feb 2023 the tables events_20230214, events_20230213, and events_20230212 the last modified date is of 15th Feb 2023, so GA is still appending data into the previous three days events table. In order to schedule a job that exports data from BQ to GCS in APPEND mode into respective date-wise folders, I am thinking of using the change history feature of BQ, only scanning data INSERTED on 15th Feb 2023 SELECT *, DATE(_CHANGE_TIMESTAMP) AS change_date FROM APPENDS(TABLE `project.dataset.events_20230214`, ""2023-02-15 00:00:00.000000 UTC"", ""2023-02-15T23:59:59.999999 UTC"") UNION ALL SELECT *, DATE(_CHANGE_TIMESTAMP) AS change_date FROM APPENDS(TABLE `project.dataset.events_20230213`, ""2023-02-15 00:00:00.000000 UTC"", ""2023-02-15T23:59:59.999999 UTC"") UNION ALL SELECT *, DATE(_CHANGE_TIMESTAMP) AS change_date FROM APPENDS(TABLE `project.dataset.events_20230212`, ""2023-02-15 00:00:00.000000 UTC"", ""2023-02-15T23:59:59.999999 UTC"") GCS URI will be like gs://bucket/table=events_20230212/change_date=20230215/* gs://bucket/table=events_20230212/change_date=20230214/* gs://bucket/table=events_20230212/change_date=20230213/* Question : Is the above approach the right way to move ahead or is there any better alternate way? Thanks Hi, Goal: To export Google Analytics 4 events data to the GCS bucket on daily basis. Approach: Exporting Table Data to BigQuery Example: EXPORT DATA OPTIONS ( uri = 'gs://bucket/folder/*.csv', format = 'CSV', overwrite = true, header = true, field_delimiter = ';') AS ( SELECT field1, field2 FROM mydataset.table1 ORDER BY field1 ); , as the GA data is nested the file format would be either Parquet or Avro. Problem: As per the official document of [GA4] BigQuery Export schema, In the events table, “ Not all devices on which events are triggered send their data to Analytics on the same day the events are triggered. To account for this latency, Analytics will update the daily tables (events_YYYYMMDD) with events for those dates for up to three days after the dates of the events. Events will have the correct time stamp regardless of arriving late. Events that arrive after that three-day window are not recorded” I’ve checked the same in our analytics dataset for today i.e 15th Feb 2023 the tables events_20230214, events_20230213, and events_20230212 the last modified date is of 15th Feb 2023, so GA is still appending data into the previous three days events table. In order to schedule a job that exports data from BQ to GCS in APPEND mode into respective date-wise folders, I am thinking of using the change history feature of BQ, only scanning data INSERTED on 15th Feb 2023 SELECT *, DATE(_CHANGE_TIMESTAMP) AS change_date FROM APPENDS(TABLE `project.dataset.events_20230214`, ""2023-02-15 00:00:00.000000 UTC"", ""2023-02-15T23:59:59.999999 UTC"") UNION ALL SELECT *, DATE(_CHANGE_TIMESTAMP) AS change_date FROM APPENDS(TABLE `project.dataset.events_20230213`, ""2023-02-15 00:00:00.000000 UTC"", ""2023-02-15T23:59:59.999999 UTC"") UNION ALL SELECT *, DATE(_CHANGE_TIMESTAMP) AS change_date FROM APPENDS(TABLE `project.dataset.events_20230212`, ""2023-02-15 00:00:00.000000 UTC"", ""2023-02-15T23:59:59.999999 UTC"") GCS URI will be like gs://bucket/table=events_20230212/change_date=20230215/ gs://bucket/table=events_20230212/change_date=20230214/ gs://bucket/table=events_20230212/change_date=20230213/ Question : Is the above approach the right way to move ahead or is there any better alternate way? Thanks Hi @darsh_shukla If I understand your goals and your questions correctly, your approach is the right way to move ahead. You are using the change history feature of BigQuery to identify the data that was inserted on February 15, 2023, and then exporting that data to Google Cloud Storage. This will ensure that you are only exporting the data that is new, and that you are not overwriting any existing data. Here are some other things to keep in mind when exporting Google Analytics 4 data to Google Cloud Storage: You can use the BigQuery Export API to export data to Google Cloud Storage in batch mode. This will allow you to export a larger amount of data at once. You can use the BigQuery Export API to export data to Google Cloud Storage in real time. This will allow you to export data as it is being generated by Google Analytics 4. You can use the BigQuery Export API to export data to Google Cloud Storage in a specific format. You can choose to export data in CSV, Avro, or Parquet format. You can use the BigQuery Export API to export data to Google Cloud Storage in a specific location. You can choose to export data to a specific bucket or folder in Google Cloud Storage. I hope this helps! @darsh_shukla thanks for the observation and the proposed solution. We have a framework which taking an date of the format ‘YYYYMMDD’ it generates an export query and i have generated the query some thing like this. But iam getting an error on line 8 saying thats not the signature for appends function. WITH changed_records AS ( SELECT *, DATE(_CHANGE_TIMESTAMP) AS change_date FROM APPENDS(TABLE `project.dataset.events_20240727`, FORMAT_TIMESTAMP('%FT%T.0000 UTC', TIMESTAMP(PARSE_DATE('%Y%m%d', '20240801'), 'UTC')), '2024-08-01T23:59:59.999999 UTC' ) ) select event_date, change_date, count(*) from changed_records group by 1, 2 order by change_date limit 10; Any suggestions or workarounds will be highly regarded. Thanks, Jai",How can we deliver recurring reporting output faster and with fewer manual steps?,general_friction,unspecified_output,P_MANUAL_REPORTING,Q_REPORT_SPEED,O_XLSX,reporting,report_speed,manual_reporting,unassigned,expansion_hard_negative_block,"metric/reporting words appear, but the real issue is setup/support/helpdesk-style rather than reconciliation/signoff pain",high,True,Hard-negative row retained to block expansion into setup/helpdesk/docs-style content.,False,False,True,setup_configuration_support
hubspot_community::1008444::01,hubspot_community,https://community.hubspot.com/t5/Reporting-Analytics/Reporting-on-External-Pages/td-p/1008444,persona_01,primary=manual_reporting||secondary=presentation_ready_output_need|recurring_export_work|spreadsheet_rework,curated_hard_negative,"Reporting on External Pages Hi there. I have a Wordpress website with the HubSpot Plugin installed (and therefor the tracking code). In HubSpot, I'd like to be able to report on the following data points related to select Wordpress pages: 1. Number of conversions per day on each page 2. Number of page views per day on each page (I'm able to create a report for page sessions, but cannot figure out how to get views. My end goal: to be able to report on the performance of select landing pages. How many views, how many conversions, conversion rate--and I'd ideally like to see that for each day. Any advice would be much appreciated! Hi there. I have a Wordpress website with the HubSpot Plugin installed (and therefor the tracking code). In HubSpot, I'd like to be able to report on the following data points related to select Wordpress pages: 1. Number of conversions per day on each page 2. Number of page views per day on each page (I'm able to create a report for page sessions, but cannot figure out how to get views. My end goal: to be able to report on the performance of select landing pages. How many views, how many conversions, conversion rate--and I'd ideally like to see that for each day. Any advice would be much appreciated!",How can we deliver recurring reporting output faster and with fewer manual steps?,tool_limitation,xlsx_report,P_TOOL_LIMITATION,Q_REPORT_SPEED,O_XLSX|O_VALIDATED_DATASET,reporting,report_speed,tool_limitation,unassigned,expansion_hard_negative_block,"metric/reporting words appear, but the real issue is setup/support/helpdesk-style rather than reconciliation/signoff pain",high,True,Hard-negative row retained to block expansion into setup/helpdesk/docs-style content.,False,False,True,setup_configuration_support
hubspot_community::1008913::01,hubspot_community,https://community.hubspot.com/t5/Reporting-Analytics/Unable-to-track-users-visitors/td-p/1008910,persona_01,primary=manual_reporting||secondary=presentation_ready_output_need|recurring_export_work|spreadsheet_rework,curated_hard_negative,"Unable to track users/visitors Hey @Devendar If you have installed the tracking code on the website you can u se HubSpot's traffic analytics tool to view website traffic data. You can create a report that includes viewing traffic by source, topic cluster, device type, country, and more kindly go through this article here: https://knowledge.hubspot.com/reports/analyze-your-site-traffic-with-the-traffic-analytics-tool Let me know if you have any follow-up questions. If you found our post helpful in resolving your query kindly mark it as an accepted solution! Hey @Devendar If you have installed the tracking code on the website you can u se HubSpot's traffic analytics tool to view website traffic data. You can create a report that includes viewing traffic by source, topic cluster, device type, country, and more kindly go through this article here: https://knowledge.hubspot.com/reports/analyze-your-site-traffic-with-the-traffic-analytics-tool Let me know if you have any follow-up questions. If you found our post helpful in resolving your query kindly mark it as an accepted solution!",How can we deliver recurring reporting output faster and with fewer manual steps?,general_friction,xlsx_report,P_HANDOFF,Q_REPORT_SPEED,O_XLSX|O_VALIDATED_DATASET,reporting,report_speed,handoff_dependency,unassigned,expansion_hard_negative_block,"metric/reporting words appear, but the real issue is setup/support/helpdesk-style rather than reconciliation/signoff pain",high,True,Hard-negative row retained to block expansion into setup/helpdesk/docs-style content.,False,False,True,setup_configuration_support
hubspot_community::1042123::01,hubspot_community,https://community.hubspot.com/t5/Reporting-Analytics/Attribution-Tracking-For-New-Contact-When-Created-In-iframe/td-p/1042123,persona_02,primary=tool_limitation_workaround||secondary=numbers_visible_but_not_explainable|root_cause_analysis_difficulty,curated_hard_negative,"Attribution Tracking For New Contact When Created In iframe Hi all, Our client has developed a custom form solution, where a potential customer can make use of a calculator to generate a quotation. In this form, a webhook is sent to HubSpot which creates a contact and deal record. The problem we encounter is that we want to have complete attribution tracking of the contact, but do not know how this can be configured using the HubSpot tracking code. The tracking code on the main website tracks the relevant attribution information, but the form in the Iframe does not have access to this data when creating the contact. Is there a way we can make this work? We are thinking that the Iframe can submit an event to the HubSpot tracking code when the form is submitted, but I cannot find the relevant documentation to set this up. Hi all, Our client has developed a custom form solution, where a potential customer can make use of a calculator to generate a quotation. In this form, a webhook is sent to HubSpot which creates a contact and deal record. The problem we encounter is that we want to have complete attribution tracking of the contact, but do not know how this can be configured using the HubSpot tracking code. The tracking code on the main website tracks the relevant attribution information, but the form in the Iframe does not have access to this data when creating the contact. Is there a way we can make this work? We are thinking that the Iframe can submit an event to the HubSpot tracking code when the form is submitted, but I cannot find the relevant documentation to set this up.",How can this workflow be made more reliable and repeatable?,tool_limitation,unspecified_output,P_TOOL_LIMITATION,Q_DIAGNOSE_ISSUE,O_VALIDATED_DATASET|O_AUTOMATION_JOB,automation,diagnose_change,tool_limitation,unassigned,expansion_hard_negative_block,iframe attribution tracking setup/support issue with metric language,high,True,Hard-negative row retained to block expansion into setup/helpdesk/docs-style content.,False,False,True,setup_configuration_support
klaviyo_community::2f33d55940699dde42537c9852f5c9a03145dbb4::01,klaviyo_community,https://community.klaviyo.com/analytics-72/is-there-a-way-to-see-a-heat-map-of-an-email-campaign-3415,persona_02,primary=tool_limitation_workaround||secondary=numbers_visible_but_not_explainable|root_cause_analysis_difficulty,curated_hard_negative,"Is there a way to see a heat map of an email campaign? Hi, I know that Klaviyo provides analytics for the links tracked in my email campaigns (Campaigns » Link Activity). However, I’d like to know if there’s a way to see the heat map of a specific email campaign. I might use the same link across different sections of my newsletter (header, image and CTA... Hi, I know that Klaviyo provides analytics for the links tracked in my email campaigns (Campaigns » Link Activity). However, I’d like to know if there’s a way to see the heat map of a specific email campaign. I might use the same link across different sections of my newsletter (header, image and CTA...",How can this workflow be made more reliable and repeatable?,general_friction,unspecified_output,P_TOOL_LIMITATION,Q_DIAGNOSE_ISSUE,O_DASHBOARD|O_AUTOMATION_JOB,automation,diagnose_change,tool_limitation,unassigned,expansion_hard_negative_block,heat-map/feature-support request with campaign analytics language,high,True,Hard-negative row retained to block expansion into setup/helpdesk/docs-style content.,False,False,True,product_helpdesk_or_feature_limitation
klaviyo_community::3302193df43555b38b71c8686070d328756c8326::01,klaviyo_community,https://community.klaviyo.com/strategic-advice-27/linking-to-costco-com-url-encoded-parameters-10326,persona_01,primary=manual_reporting||secondary=presentation_ready_output_need|recurring_export_work|tool_limitation_workaround,curated_hard_negative,"Linking to Costco.com: URL encoded parameters Posting this as a PSA for anyone else who runs across this issue in the future and (fingers crossed) generate some momentum for the Klaviyo eng team to make an update for this edge case. TLDR: Linking to Costco’s website via a Klaviyo email campaign does not work unless you disable the global account setting “Email to website tracking” because of some Costco server-side security.That setting can be disabled by going to Settings &gt; Email &gt; Attribution.Longer version:I went to send an email about a new product we have listed on Costco.com but repeatedly got server errors on Costco’s site when I tested the link out of Klaviyo. This was with the campaign UTM tracking disabled (this will be important in a second).From Klaviyo, the Costco link is appended the following URL parameter from our account: ?_kx=ABCDEFGHIJKLMNOP%3D%3D.UHFmv9 . This is added because the global account setting ""Email to website tracking"" is enabled.This URL, while correct, causes an error on the Costco servers. It seems like that error is caused by the %3D%3D in the Klaviyo URL parameter. Those characters are URL encoded ""=="" and likely blocked for valid security reasons. (I don’t see Costco changing these server-side security parameters any time soon based on a request from anyone external, for good reason.)So I opened a support chat with Klaviyo and they told me to turn off the campaign UTM tracking, which was already off. After a few moments, they said the only way to turn this off is by disabling the global account setting ""Email to website tracking."" There is no way to disable this on the campaign level, which is obviously not great if you want any sort of data on your other email campaigns or flows that could be going out at the same time.I opened a more formal bug report/feature request asking if Klaviyo is able to remove the %3D%3D and after about a month of back and forth was told:The engineer got back to me and said that there are no plans at this time to remove the %3D%3D string from the _kx parameter for website tracking as we have not received many reports on this breaking for customers' websites. But they will take this feedback into account in case there are any plans on updating our tracking in the future. I fully recognize that asking Klaviyo to change a global account setting URL parameters for all customers is a high-risk proposition that could break all sorts of stuff, but it also feels dumb to me that any customer that wants to send a Costco link cannot do so unless they disable a global account setting.If anyone knows of a workaround, I would love to hear it, but I’m mostly just posting this for any other poor soul that runs across this edge case. Posting this as a PSA for anyone else who runs across this issue in the future and (fingers crossed) generate some momentum for the Klaviyo eng team to make an update for this edge case. TLDR: Linking to Costco’s website via a Klaviyo email campaign does not work unless you disable the global account setting “Email to website tracking” because of some Costco server-side security.That setting can be disabled by going to Settings &gt; Email &gt; Attribution.Longer version:I went to send an email about a new product we have listed on Costco.com but repeatedly got server errors on Costco’s site when I tested the link out of Klaviyo. This was with the campaign UTM tracking disabled (this will be important in a second).From Klaviyo, the Costco link is appended the following URL parameter from our account: ?_kx=ABCDEFGHIJKLMNOP%3D%3D.UHFmv9 . This is added because the global account setting ""Email to website tracking"" is enabled.This URL, while correct, causes an error on the Costco servers. It seems like that error is caused by the %3D%3D in the Klaviyo URL parameter. Those characters are URL encoded ""=="" and likely blocked for valid security reasons. (I don’t see Costco changing these server-side security parameters any time soon based on a request from anyone external, for good reason.)So I opened a support chat with Klaviyo and they told me to turn off the campaign UTM tracking, which was already off. After a few moments, they said the only way to turn this off is by disabling the global account setting ""Email to website tracking."" There is no way to disable this on the campaign level, which is obviously not great if you want any sort of data on your other email campaigns or flows that could be going out at the same time.I opened a more formal bug report/feature request asking if Klaviyo is able to remove the %3D%3D and after about a month of back and forth was told:The engineer got back to me and said that there are no plans at this time to remove the %3D%3D string from the _kx parameter for website tracking as we have not received many reports on this breaking for customers' websites. But they will take this feedback into account in case there are any plans on updating our tracking in the future. I fully recognize that asking Klaviyo to change a global account setting URL parameters for all customers is a high-risk proposition that could break all sorts of stuff, but it also feels dumb to me that any customer that wants to send a Costco link cannot do so unless they disable a global account setting.If anyone knows of a workaround, I would love to hear it, but I’m mostly just posting this for any other poor soul that runs across this edge case.",How can we deliver recurring reporting output faster and with fewer manual steps?,tool_limitation,xlsx_report,P_TOOL_LIMITATION,Q_REPORT_SPEED,O_XLSX|O_DASHBOARD|O_VALIDATED_DATASET|O_AUTOMATION_JOB,reporting,report_speed,tool_limitation,unassigned,expansion_hard_negative_block,"metric/reporting words appear, but the real issue is setup/support/helpdesk-style rather than reconciliation/signoff pain",high,True,Hard-negative row retained to block expansion into setup/helpdesk/docs-style content.,False,False,True,setup_configuration_support
metabase_discussions::10082::02,metabase_discussions,https://discourse.metabase.com/t/how-to-get-trends-to-work-with-dashboard-filters/10082,persona_02,primary=root_cause_analysis_difficulty||secondary=numbers_visible_but_not_explainable,curated_hard_negative,"Hi @business_per_usual Currently you would have to do some hacking with Native/SQL to change the grouping either depending on period span or with a text variable filter, or like you suggest, use multiple questions. There’s a request for this feature: https://github.com/metabase/metabase/issues/5346 - upvote by clicking on the first post You might also be interested in this issue: https://github.com/metabase/metabase/issues/8977 Hey Flamber, that is what I tried but ultimately couldn’t figure out. Do you have any examples of how to achieve this? I did google search things like""MySQL month to month growth"" etc etc and tried to use their examples but couldn’t get it to work unfortunately. Would love to pay $15 a month or whatever for metabase to increase their development speed. Really love the project, just seems slow in terms of improvement which is understandable due to it being free. @business_per_usual So how did you create the current questions? If they’re created via the interface, then simply convert it to SQL: https://www.metabase.com/docs/latest/users-guide/custom-questions.html#viewing-the-sql-that-powers-your-question And then you would add two filters to that. One Field Filter for the date period, and one Text filter for the grouping: https://www.metabase.com/docs/latest/users-guide/08-dashboard-filters.html Metabase is a massive project, but it is open source, so you could find developers and have them submit PRs.",How can we diagnose and resolve analytics issues faster?,handoff_friction,dashboard_update,P_HANDOFF,Q_DIAGNOSE_ISSUE,O_DASHBOARD,triage,diagnose_change,handoff_dependency,unassigned,expansion_hard_negative_block,dashboard filter feature-workaround/help request with reporting terms,high,True,Hard-negative row retained to block expansion into setup/helpdesk/docs-style content.,False,False,True,product_helpdesk_or_feature_limitation
