episode_id,source,source_url,current_persona_id,current_cluster_signature,candidate_source_pool,normalized_episode,business_question,bottleneck_text,desired_output,pain_codes,question_codes,output_codes,workflow_stage,analysis_goal,bottleneck_type,trust_validation_need,expansion_label,expansion_reason,expansion_confidence,manually_reviewed,reviewer_note,should_join_persona_04,should_remain_persona_01_parent,should_block_persona_04_expansion,hard_negative_subtype
klaviyo_community::0f56fb8da711b6623802fffcfa5a47343a7c5237::01,klaviyo_community,https://community.klaviyo.com/analytics-72/apple-privacy-protection-mpp-cheat-sheet-6087,persona_01,primary=manual_reporting||secondary=recurring_export_work|spreadsheet_rework,curated_reporting_packager_parent,"Apple Privacy Protection (MPP) Cheat Sheet Apple Privacy Protection (MPP) Cheat SheetSince Apple launched the new iOS 15 in 2021, we know you have a lot of questions around Apple Privacy Protection and how it impacts your email marketing strategy. The Growth Success team is here to break down key takeaways about this feature and share strategies on ways you can adapt to these new changes. Check out our Apple Privacy Protection Cheat Sheet link above! Frequently Asked Questions about Apple Privacy Protection: 1. Are Open Rates important anymore?Open rates will likely always be inflated due to the Apple Privacy Protection. We recommend the following: Open Rates stay consistent around the same percentage across all campaign sends. Look at Advanced Reporting in a Campaign to make sure all inbox providers are seeing similar rates as Apple Privacy Protection does not trigger if the email lands in spam so it is very obvious when an inbox provider is landing in spam. Prioritize tracking Click Rate (not CTR) to make sure it is over 1% as Click Rate is not inflated by APP but can be impacted by segmentation that does not include the APP filter. 2. Revenue Attribution: How Does This Affect My Revenue Attribution?We expect at least some accounts to experience inflated open rates. We know this can lead to misleading attributions. That’s why we’re giving you the option to change to either a click-only email attribution model, or to omit only Apple privacy opens from your email attribution.If Apple mail accounts for the minority of your total email opens, or you don’t engage in marketing outside of the email channel, you may want to remain on the “opened or clicked email” attribution model. If Apple privacy opens account for the majority of your total email opens, and you are experiencing inflated total revenue attribution across your marketing channels, we recommend switching to “opened or clicked email (excluding Apple privacy opens)” as your attribution model. 3. I just started with Klaviyo. Is this something I need to be aware of as I’m warming my account?If you are just getting started with Klaviyo, or have a list size that’s less than 1,000 contacts - you likely have areas of higher impact that you want to focus on right now. Keep an eye on the changes and consider using Click Rates as your primary engagement metric. 4. How does this affect my email subscriber List?There are a couple ways Klaviyo will be helping you understand the impact to your account. We recommend the following: Segment your audience by using the Apple Privacy Opens to find out exactly who is using mail privacy protection (see Audience Segmentation section above). Run a single metric deep dive report to see how many Apple Privacy opens are occurring over time. 5. What steps do I need to take to be ready for BFCM?Now is a great time to follow these steps above to determine how many subscribers have Apple Privacy Protection enabled to help you prepare for BFCM, who you will be targeting during the holiday weekend, and how to monitor your email performance. Have more questions? Please share with us by commenting below! Apple Privacy Protection (MPP) Cheat SheetSince Apple launched the new iOS 15 in 2021, we know you have a lot of questions around Apple Privacy Protection and how it impacts your email marketing strategy. The Growth Success team is here to break down key takeaways about this feature and share strategies on ways you can adapt to these new changes. Check out our Apple Privacy Protection Cheat Sheet link above! Frequently Asked Questions about Apple Privacy Protection: 1. Are Open Rates important anymore?Open rates will likely always be inflated due to the Apple Privacy Protection. We recommend the following: Open Rates stay consistent around the same percentage across all campaign sends. Look at Advanced Reporting in a Campaign to make sure all inbox providers are seeing similar rates as Apple Privacy Protection does not trigger if the email lands in spam so it is very obvious when an inbox provider is landing in spam. Prioritize tracking Click Rate (not CTR) to make sure it is over 1% as Click Rate is not inflated by APP but can be impacted by segmentation that does not include the APP filter. 2. Revenue Attribution: How Does This Affect My Revenue Attribution?We expect at least some accounts to experience inflated open rates. We know this can lead to misleading attributions. That’s why we’re giving you the option to change to either a click-only email attribution model, or to omit only Apple privacy opens from your email attribution.If Apple mail accounts for the minority of your total email opens, or you don’t engage in marketing outside of the email channel, you may want to remain on the “opened or clicked email” attribution model. If Apple privacy opens account for the majority of your total email opens, and you are experiencing inflated total revenue attribution across your marketing channels, we recommend switching to “opened or clicked email (excluding Apple privacy opens)” as your attribution model. 3. I just started with Klaviyo. Is this something I need to be aware of as I’m warming my account?If you are just getting started with Klaviyo, or have a list size that’s less than 1,000 contacts you likely have areas of higher impact that you want to focus on right now. Keep an eye on the changes and consider using Click Rates as your primary engagement metric. 4. How does this affect my email subscriber List?There are a couple ways Klaviyo will be helping you understand the impact to your account. We recommend the following: Segment your audience by using the Apple Privacy Opens to find out exactly who is using mail privacy protection (see Audience Segmentation section above). Run a single metric deep dive report to see how many Apple Privacy opens are occurring over time. 5. What steps do I need to take to be ready for BFCM?Now is a great time to follow these steps above to determine how many subscribers have Apple Privacy Protection enabled to help you prepare for BFCM, who you will be targeting during the holiday weekend, and how to monitor your email performance. Have more questions? Please share with us by commenting below!",How can we deliver recurring reporting output faster and with fewer manual steps?,general_friction,xlsx_report,P_MANUAL_REPORTING,Q_REPORT_SPEED,O_XLSX|O_VALIDATED_DATASET,reporting,report_speed,manual_reporting,unassigned,expansion_parent_should_stay_persona_01,"report_speed + reporting with manual_reporting reflects recurring reporting-packager work, not metric trust failure",high,True,Reporting-packager row retained to test parent retention during expansion.,False,True,False,
metabase_discussions::10014::01,metabase_discussions,https://discourse.metabase.com/t/when-i-am-trying-to-save-my-question-i-receive-error-permission-denied-for-table-report-card/10014,persona_01,primary=manual_reporting||secondary=presentation_ready_output_need|recurring_export_work|spreadsheet_rework,curated_reporting_packager_parent,"When I am trying to save my question, I receive ERROR: permission denied for table report_card image 811×548 19.5 KB I have written a query and when I try to save the query, the above error message appears. I run the query without any issue and can see the data clearly in the table below. However, I cannot seem to save it. Does anyone have any ideas? Cheers image 811×548 19.5 KB I have written a query and when I try to save the query, the above error message appears. I run the query without any issue and can see the data clearly in the table below. However, I cannot seem to save it. Does anyone have any ideas? Cheers Hi @jord99 Please post “Diagnostic Info” from Admin > Troubleshooting. Also check Admin > Troubleshooting > Logs for more details about the error.",How can we deliver recurring reporting output faster and with fewer manual steps?,tool_limitation,xlsx_report,P_TOOL_LIMITATION,Q_REPORT_SPEED,O_XLSX,reporting,report_speed,tool_limitation,unassigned,expansion_parent_should_stay_persona_01,"report_speed + reporting with tool_limitation reflects recurring reporting-packager work, not metric trust failure",high,True,Reporting-packager row retained to test parent retention during expansion.,False,True,False,
metabase_discussions::10110::01,metabase_discussions,https://discourse.metabase.com/t/pivot-table-seems-to-have-incorrect-row-count/10110,persona_01,primary=manual_reporting||secondary=recurring_export_work|spreadsheet_rework,curated_reporting_packager_parent,"Pivot table seems to have incorrect row count We have a pivot table question with 10 distinct groups in the rows and 10 distinct groups in the columns but metabase says in the bottom right corner “Showing 100 rows”, which is incorrect. Can metabase be configured to report the correct row count for a pivot table? We have a pivot table question with 10 distinct groups in the rows and 10 distinct groups in the columns but metabase says in the bottom right corner “Showing 100 rows”, which is incorrect. Can metabase be configured to report the correct row count for a pivot table? Hi @peterbase I’ve created an issue for it: https://github.com/metabase/metabase/issues/12522 - upvote by clicking on the first post Thanks @flamber",How can we deliver recurring reporting output faster and with fewer manual steps?,general_friction,xlsx_report,P_MANUAL_REPORTING,Q_REPORT_SPEED,O_XLSX,reporting,report_speed,manual_reporting,unassigned,expansion_parent_should_stay_persona_01,"report_speed + reporting with manual_reporting reflects recurring reporting-packager work, not metric trust failure",high,True,Reporting-packager row retained to test parent retention during expansion.,False,True,False,
mixpanel_community::30777b10632fff6958450c048346c0c4575837c9::01,mixpanel_community,https://community.mixpanel.com/x/questions/4isvl9fnkdv7/mixpanel-free-plan-issues-with-event-tracking-and,persona_01,primary=manual_reporting||secondary=recurring_export_work|spreadsheet_rework,curated_reporting_packager_parent,"Mixpanel Free Plan: Issues with Event Tracking and Reporting Hey team! Having a weird issue with our Mixpanel free plan. We're getting the ""temporarily disabled report access"" banner (likely hit the 1M event limit), but here's the strange part: • In the Events tab: I can see that 2 users triggered [specific event name] 3 days ago (September 2, 2025) • In my report: I filtered for the same event within the last 30 days, those 2 users do not appear in the results Does this mean when exceeding 1 million events in Free plan, events are still being tracked, but reports seem frozen with old data? Trying to figure out if this is expected behavior or if we're losing analytics data permanently.",How can we deliver recurring reporting output faster and with fewer manual steps?,general_friction,xlsx_report,P_MANUAL_REPORTING,Q_REPORT_SPEED,O_XLSX|O_VALIDATED_DATASET,reporting,report_speed,manual_reporting,unassigned,expansion_parent_should_stay_persona_01,"report_speed + reporting with manual_reporting reflects recurring reporting-packager work, not metric trust failure",high,True,Reporting-packager row retained to test parent retention during expansion.,False,True,False,
mixpanel_community::4c51bdcd61357f830bdd14a19cfe182e99e8155e::01,mixpanel_community,https://community.mixpanel.com/x/questions/d2ut939vmwmm/how-to-filter-events-within-7-days-of-users-first,persona_01,primary=manual_reporting||secondary=presentation_ready_output_need|recurring_export_work|spreadsheet_rework,curated_reporting_packager_parent,"How to Filter Events Within 7 Days of User's First Seen Date in Insights Report Hello! I'm trying to create an Insights report to identify our Product Adoption Indicator by analyzing user behaviour in their first week after signing up. I want to filter for: • Users whose SIgn up ""First Seen"" event date is in the last 30 days • AND Total events for Event B that occurred within 7 days of each user's ""First Seen"" date I've successfully filtered for ""First Seen in last 30 days,"" but I can't figure out how to add the second condition: "" where event Time within 7 days of First Seen."" Is this possible in the Insights interface, or do I need to use a different report type or custom formula?"" I also tried doing it in the retention report, but was not able to set it up to measure only total events. That was not an option there. Hello! I'm trying to create an Insights report to identify our Product Adoption Indicator by analyzing user behaviour in their first week after signing up. I want to filter for: • Users whose SIgn up ""First Seen"" event date is in the last 30 days • AND Total events for Event B that occurred within 7 days of each user's ""First Seen"" date I've successfully filtered for ""First Seen in last 30 days,"" but I can't figure out how to add the second condition: "" where event Time within 7 days of First Seen."" Is this possible in the Insights interface, or do I need to use a different report type or custom formula?"" I also tried doing it in the retention report, but was not able to set it up to measure only total events. That was not an option there.",How can we deliver recurring reporting output faster and with fewer manual steps?,tool_limitation,xlsx_report,P_TOOL_LIMITATION,Q_REPORT_SPEED,O_XLSX,reporting,report_speed,tool_limitation,unassigned,expansion_parent_should_stay_persona_01,"report_speed + reporting with tool_limitation reflects recurring reporting-packager work, not metric trust failure",high,True,Reporting-packager row retained to test parent retention during expansion.,False,True,False,
power_bi_community::4634210::01,power_bi_community,https://community.fabric.microsoft.com/t5/Service/PowerBI-reports-apps-in-web-browser-not-working/td-p/4633438,persona_01,primary=manual_reporting||secondary=presentation_ready_output_need|recurring_export_work|spreadsheet_rework,curated_reporting_packager_parent,"PowerBI reports/apps in web browser not working Hi @Asnate It might be a temporary Power BI Service issue or a network restriction affecting some users. Check the Power BI status page and try using Incognito mode or relogging into Power BI.If nothing works, contact your IT team to check for any network restrictions. Hi @Asnate It might be a temporary Power BI Service issue or a network restriction affecting some users. Check the Power BI status page and try using Incognito mode or relogging into Power BI.If nothing works, contact your IT team to check for any network restrictions.",How can we deliver recurring reporting output faster and with fewer manual steps?,general_friction,xlsx_report,P_TOOL_LIMITATION,Q_REPORT_SPEED,O_XLSX,reporting,report_speed,tool_limitation,unassigned,expansion_parent_should_stay_persona_01,"report_speed + reporting with tool_limitation reflects recurring reporting-packager work, not metric trust failure",high,True,Reporting-packager row retained to test parent retention during expansion.,False,True,False,
power_bi_community::4634522::01,power_bi_community,https://community.fabric.microsoft.com/t5/Service/quot-InvalidRequest-quot-error-while-generating-access-tokken/td-p/4634522,persona_01,primary=manual_reporting||secondary=presentation_ready_output_need|recurring_export_work|spreadsheet_rework,curated_reporting_packager_parent,"""InvalidRequest"" error while generating access tokken for PPU licence Hi community, We are using the PPU licence and service principle to embed reports for user, now this is giving me error. { ""error"": { ""code"": ""InvalidRequest"", ""message"": ""Embedding is disabled on tenant level"" } } Hi community, We are using the PPU licence and service principle to embed reports for user, now this is giving me error. { ""error"": { ""code"": ""InvalidRequest"", ""message"": ""Embedding is disabled on tenant level"" } }",How can we deliver recurring reporting output faster and with fewer manual steps?,handoff_friction,xlsx_report,P_HANDOFF,Q_REPORT_SPEED,O_XLSX,reporting,report_speed,handoff_dependency,unassigned,expansion_parent_should_stay_persona_01,"report_speed + reporting with handoff_dependency reflects recurring reporting-packager work, not metric trust failure",high,True,Reporting-packager row retained to test parent retention during expansion.,False,True,False,
qlik_community::1220090::01,qlik_community,https://community.qlik.com/t5/App-Development/qlik-sense-exporting-pivot-table-to-excel-file-with-look-feel/td-p/1220090,persona_01,primary=manual_reporting||secondary=recurring_export_work|spreadsheet_rework,curated_reporting_packager_parent,"qlik sense exporting pivot table to excel file with look & feel Hello, We are trying to export pivot table to excel preserving layout and format (ex. color settings). We'd like to create an extension for this because the default export only do an export data. We also tried to use data export API but this only exports data. We don't know how to get the measure color property of pivot table. Someone can help us and guide us to the right direction ? Many thanks in advance for your time. Best regards Andrea",How can we deliver recurring reporting output faster and with fewer manual steps?,general_friction,xlsx_report,P_MANUAL_REPORTING,Q_REPORT_SPEED,O_XLSX,reporting,report_speed,manual_reporting,unassigned,expansion_parent_should_stay_persona_01,"report_speed + reporting with manual_reporting reflects recurring reporting-packager work, not metric trust failure",high,True,Reporting-packager row retained to test parent retention during expansion.,False,True,False,
qlik_community::1306389::01,qlik_community,https://community.qlik.com/t5/App-Development/Error-in-Qlik-sense-excel-export-like-quot-The-hypercube-results/td-p/1306389,persona_01,primary=manual_reporting||secondary=recurring_export_work|spreadsheet_rework,curated_reporting_packager_parent,"Error in Qlik sense excel export like ""The hypercube results are too large"" Excel export is not working for large report data. Getting error message like ""The hypercube results are too large"". Please help us to resolve this error.",How can we deliver recurring reporting output faster and with fewer manual steps?,manual_reporting,xlsx_report,P_MANUAL_REPORTING|P_TOOL_LIMITATION,Q_REPORT_SPEED,O_XLSX,reporting,report_speed,manual_reporting,unassigned,expansion_parent_should_stay_persona_01,"report_speed + reporting with manual_reporting reflects recurring reporting-packager work, not metric trust failure",high,True,Reporting-packager row retained to test parent retention during expansion.,False,True,False,
reddit::1rqxlg9::02,reddit,https://www.reddit.com/r/AdfynxAI/comments/1rqxlg9/measuring_roas_in_2026_whats_noisier_what_still/,persona_01,primary=manual_reporting||secondary=presentation_ready_output_need|recurring_export_work|tool_limitation_workaround,curated_reporting_packager_parent,"**AI prediction platforms forecast ROAS 30 minutes to 48 hours ahead* with improved accuracy for scaling decisions **Cross-platform data unification solves attribution fragmentation* across Facebook, Google, TikTok, and analytics tools **Real-time prediction updates every 30 minutes* catch performance changes before they impact daily budgets **Audience saturation modeling predicts when targeting hits diminishing returns* before performance declines **Creative fatigue prediction identifies refresh timing* before CTR drops and CPC rises **Automated budget allocation recommendations* distribute spend based on predicted performance, not historical data # Why traditional ROAS tracking falls short (and what AI prediction solves) You're staring at your dashboard at 2 AM, trying to decide whether to increase budget on a campaign showing 3.2 ROAS. Will it maintain performance? Drop to break-even? Or surprise you with 5x returns? This scenario plays out daily for performance marketers caught between missing opportunities and throwing good money after bad. # Attribution accuracy crisis Traditional ROAS tracking struggles with multi-touchpoint customer journeys. A customer might see your Facebook ad, research on Google, read reviews on your website, then convert three days later through a direct visit. Which platform gets credit? Facebook says Facebook. Google says Google. Your analytics platform disagrees with both. This attribution chaos means your ""winning"" campaigns might actually lose money, while your ""losing"" campaigns drive profitable conversions credited elsewhere. # Time lag effects in conversion reporting In e-commerce, conversions often don't happen instantly—customers may take several days or weeks before purchasing after clicking an ad. This means real-time ROAS data rarely reflects current campaign effectiveness. When you see strong ROAS today, much comes from ads you ran previously. Meanwhile, today's ads won't reveal actual performance until days later. This time lag creates dangerous feedback loops where you scale campaigns based on outdated performance data, often increasing budgets just as creative fatigue sets in. # Platform reporting inconsistencies Ever notice how your Facebook ROAS never matches Google Analytics revenue? Or how Shopify reports different conversion values than your ad platforms? Data fragmentation between Facebook, Instagram, and analytics tools creates blind spots that traditional tracking can't solve, even within the Meta ecosystem. The average performance marketer checks multiple dashboards daily to get complete campaign performance pictures. >**If you want to consolidate this data fragmentation…* [Adfynx](https://www.adfynx.com/) connects creative analysis, performance tracking, and account health into one read-only workspace, highlighting attribution gaps and measurement discrepancies without changing campaign settings. **What AI prediction platforms solve:*",How can we deliver recurring reporting output faster and with fewer manual steps?,tool_limitation,xlsx_report,P_TOOL_LIMITATION,Q_REPORT_SPEED|Q_AUTOMATE_WORKFLOW,O_XLSX|O_DASHBOARD|O_VALIDATED_DATASET,reporting,report_speed,tool_limitation,unassigned,expansion_parent_should_stay_persona_01,"report_speed + reporting with tool_limitation reflects recurring reporting-packager work, not metric trust failure",high,True,Reporting-packager row retained to test parent retention during expansion.,False,True,False,
