episode_id,source,source_url,current_persona_id,current_cluster_signature,candidate_source_pool,normalized_episode,business_question,bottleneck_text,desired_output,pain_codes,question_codes,output_codes,workflow_stage,analysis_goal,bottleneck_type,trust_validation_need,expansion_label,expansion_reason,expansion_confidence,manually_reviewed,reviewer_note,should_join_persona_04,should_remain_persona_01_parent,should_block_persona_04_expansion,hard_negative_subtype
metabase_discussions::22506::02,metabase_discussions,https://discourse.metabase.com/t/error-when-i-try-to-explore-data-without-any-filters/22506,persona_02,primary=root_cause_analysis_difficulty||secondary=dashboard_mistrust|metric_reconciliation|numbers_visible_but_not_explainable,high_conf_validation_non_persona04,"Hi @lesescaldes Something is indicating that you have a nested JSON structure, which is not matching for all rows. Sounds like https://github.com/metabase/metabase/issues/25744 - upvote by clicking on the first post",How can we diagnose and resolve analytics issues faster?,general_friction,unspecified_output,P_DATA_QUALITY,Q_DIAGNOSE_ISSUE,O_DASHBOARD,triage,diagnose_change,data_quality,medium,expansion_positive_should_join_persona_04,Outside-persona_04 row has strong validation/data-quality/trust signals and is suitable for expansion-gain testing.,medium_high,True,Strict outside-persona_04 reconciliation/signoff candidate chosen for expansion-gain simulation.,True,False,False,
metabase_discussions::25130::01,metabase_discussions,https://discourse.metabase.com/t/we-get-random-duplicate-rows/25130,persona_01,primary=manual_reporting||secondary=presentation_ready_output_need|recurring_export_work,reconcile_boost_moved_outside_persona04,"We need diagnostic info and also some reproduction steps I too ran into this one the last couple of days. I suspect the ""bug"" might be Metabase having to do more lookups on joins than it can really handle efficiently. Let me describe our structure and issue: We have a monthly sales file for books, the common key between the sales table and the title metadata table being the ISBN. We are building a table that gets the net units and dollars for the first year of a book since publication, then years 1-3, 1-5, 1-10, and finally 1-20. All of these are organized in a table with the ISBN as the key, then the publication period, the 1 year period, followed by the 3 year and later (if applicable). On our dashboard, we have filters to select by various book attributes, for example binding, publication date range, marketing color code, and so on. In order for people to be able to select the filters they want, the sales table joins the ISBN for the titles table. We get phantom duplicates (125 records extra out of a total 11,710 total in the table), when we have five additional joins turned on. This is to allow the users to view the description of the pertinent field, rather than having to remember a code. So the editor drop-down will show the editor code as well as name, same for the series and primary subject. Where it started going wonky is when I added the secondary subject codes, of which there are two. Both originate in a common subjects table. So I was having Metabase do two lookups to the common subject table. Thinking that might be the issue, I cloned the subject definition table so as to have code 1 lookup the first subject table and code 2 to the cloned version. The problem persisted. After removing the second subject lookup, the number of duplicates went from 125 to 81. When I removed both of these joins, the issue went away and I got the correct number of records. So it seems that there is a bug if there are more than 3 joins from an already joined table, secondary joins, I suppose you could call them. Hope this helps. P.S. I solved the immediate problem by adding the subject code descriptions to the main title file so it won't have to look up the subjects table anymore. Not exactly best practice according to relational database theory, but I figure since this is a reporting, rather than transaction processing oriented database, if we have to bend the rules a bit for Metabase to work properly, as the saying goes, ""ya gotta do what ya gotta do.""",How can we deliver recurring reporting output faster and with fewer manual steps?,general_friction,xlsx_report,P_DATA_QUALITY,Q_REPORT_SPEED,O_XLSX|O_DASHBOARD,reporting,report_speed,data_quality,medium,expansion_positive_should_join_persona_04,Outside-persona_04 row was previously drawn toward reconciliation-like clustering and still matches persona_04 semantic profile.,medium_high,True,Strict outside-persona_04 reconciliation/signoff candidate chosen for expansion-gain simulation.,True,False,False,
mixpanel_community::33ba0852c40bdfaf811544283ebd95ee58b38474::01,mixpanel_community,https://community.mixpanel.com/x/questions/l3wo2mh6ry58/discrepancy-in-retention-report-user-count-need-he,persona_01,primary=manual_reporting||secondary=dashboard_mistrust|metric_reconciliation|recurring_export_work,curated_positive_outside_persona04,"Discrepancy in Retention Report User Count: Need Help! Hello everyone, I have a problem reading the data from the retention report. I created a cohort report with two events, and the total number of users is 124. But when I go to the retention report to analyze the same metrics over the same time period, the total number of users is different. Even when I use the filter for users in that cohort, a higher number of users is shown. How is that possible? Really appreciate if anyone can help me with this! :heart: Hello everyone, I have a problem reading the data from the retention report. I created a cohort report with two events, and the total number of users is 124. But when I go to the retention report to analyze the same metrics over the same time period, the total number of users is different. Even when I use the filter for users in that cohort, a higher number of users is shown. How is that possible? Really appreciate if anyone can help me with this! :heart:",How can we deliver recurring reporting output faster and with fewer manual steps?,general_friction,xlsx_report,P_DATA_QUALITY,Q_REPORT_SPEED,O_XLSX,reporting,report_speed,data_quality,medium,expansion_positive_should_join_persona_04,report_speed + reporting with data_quality and medium indicates genuine reconciliation/signoff pain,high,True,Strict outside-persona_04 reconciliation/signoff candidate chosen for expansion-gain simulation.,True,False,False,
power_bi_community::4636123::01,power_bi_community,https://community.fabric.microsoft.com/t5/Service/Using-Cluster-in-PBI-Service-throws-an-error/td-p/4628173,persona_02,primary=metric_reconciliation||secondary=numbers_visible_but_not_explainable|repeated_validation_before_sending|root_cause_analysis_difficulty,high_conf_validation_non_persona04,"Using Cluster in PBI Service throws an error Hi @zahirmohideen , Based on your scenario, I understand that the error occurs after a subsequent data refresh. Since reprocessing the semantic model worked initially but failed after the second data refresh, it indicates that the issue might be related to the data refresh. Check the data refresh logs and schema changes. If the underlying schema of the data source has been modified such as column names, data types, or table structures, it could cause the model to break. Validate data consistency, especially around the Mailing Zip Code column. Ensure this column is populated correctly, and check for nulls, incorrect values, or invalid formats. Additionally, validate the relationships in your model and check for any missing or broken relationships that could be causing issues. If any relationships are invalid, they can break the model and cause errors during refresh, Ensure there are no missing or broken relationships between tables, especially if clusters relies on certain tables being joined. Also try to reprocess the model to fix any invalid states that might have occurred after the data refresh. Look for errors like missing data, data type mismatches, or data truncation that might be contributing to the failure. If this post helps, then please consider Accepting as solution to help the other members find it more quickly, don't forget to give a ""Kudos"" – I’d truly appreciate it! Thanks and regards, Anjan Kumar Chippa Hi @zahirmohideen , Based on your scenario, I understand that the error occurs after a subsequent data refresh. Since reprocessing the semantic model worked initially but failed after the second data refresh, it indicates that the issue might be related to the data refresh. Check the data refresh logs and schema changes. If the underlying schema of the data source has been modified such as column names, data types, or table structures, it could cause the model to break. Validate data consistency, especially around the Mailing Zip Code column. Ensure this column is populated correctly, and check for nulls, incorrect values, or invalid formats. Additionally, validate the relationships in your model and check for any missing or broken relationships that could be causing issues. If any relationships are invalid, they can break the model and cause errors during refresh, Ensure there are no missing or broken relationships between tables, especially if clusters relies on certain tables being joined. Also try to reprocess the model to fix any invalid states that might have occurred after the data refresh. Look for errors like missing data, data type mismatches, or data truncation that might be contributing to the failure. If this post helps, then please consider Accepting as solution to help the other members find it more quickly, don't forget to give a ""Kudos"" – I’d truly appreciate it! Thanks and regards, Anjan Kumar Chippa",How can we diagnose and resolve analytics issues faster?,data_quality,unspecified_output,P_DATA_QUALITY|P_TOOL_LIMITATION,Q_DIAGNOSE_ISSUE,O_VALIDATED_DATASET,validation,diagnose_change,data_quality,medium,expansion_positive_should_join_persona_04,Outside-persona_04 row has strong validation/data-quality/trust signals and is suitable for expansion-gain testing.,medium_high,True,Strict outside-persona_04 reconciliation/signoff candidate chosen for expansion-gain simulation.,True,False,False,
power_bi_community::4798382::01,power_bi_community,https://community.fabric.microsoft.com/t5/Service/Discrepancy-between-report-and-backend-query-dimension-table/td-p/4798382,persona_01,primary=manual_reporting||secondary=metric_reconciliation|recurring_export_work|repeated_validation_before_sending,anchor_variant_B_like_move,"Discrepancy between report and backend query - dimension table issue One of our internal users created a report that effectively displays a table for each customer, and their total transaction amount for 2025. Relatively simple query at the end of the day, but there was an issue I noticed. At random points in time (compared to manually pulling from the backend for validation), if I ran this same report, with the same filter parameters, I would get the same number of line items, but different customer names associated with the transaction amounts. If we think of the transaction amounts as being ordered ASC, they are all the same, but the customer names associated to those amounts will differ. John Smith: $113,124 Alice Jones: $232,333 Bob Burger: $345,241 Will turn into Nick Lee: $113,124 Catherine Height: $232,333 Jacob Ladder: $345,241 When I refreshed the semantic model that runs the report, it effectively resolves the issue. This behavior doesn't seem to make sense to me. I could understand that if the names were consistently wrong compared to the database it pulls from as it would suggest some kind of join condition issue in the way the model is created between my fact table and customer dimension. For reference I have the model refresh once daily in the AM. What could be occurring here? One of our internal users created a report that effectively displays a table for each customer, and their total transaction amount for 2025. Relatively simple query at the end of the day, but there was an issue I noticed. At random points in time (compared to manually pulling from the backend for validation), if I ran this same report, with the same filter parameters, I would get the same number of line items, but different customer names associated with the transaction amounts. If we think of the transaction amounts as being ordered ASC, they are all the same, but the customer names associated to those amounts will differ. John Smith: $113,124 Alice Jones: $232,333 Bob Burger: $345,241 Will turn into Nick Lee: $113,124 Catherine Height: $232,333 Jacob Ladder: $345,241 When I refreshed the semantic model that runs the report, it effectively resolves the issue. This behavior doesn't seem to make sense to me. I could understand that if the names were consistently wrong compared to the database it pulls from as it would suggest some kind of join condition issue in the way the model is created between my fact table and customer dimension. For reference I have the model refresh once daily in the AM. What could be occurring here?",How can we validate and reconcile reported numbers with less manual QA?,manual_reporting,xlsx_report,P_MANUAL_REPORTING|P_DATA_QUALITY,Q_VALIDATE_NUMBERS,O_XLSX,reporting,validate_numbers,manual_reporting,high,expansion_positive_should_join_persona_04,Outside-persona_04 row matches persona_04 validation/trust profile closely enough to test safe expansion.,medium_high,True,Strict outside-persona_04 reconciliation/signoff candidate chosen for expansion-gain simulation.,True,False,False,
power_bi_community::5004734::01,power_bi_community,https://community.fabric.microsoft.com/t5/Desktop/Guidance-on-Uncertified-Visuals-and-Government-Best-Practices/td-p/5004544,persona_08,primary=tool_limitation_workaround||secondary=metric_reconciliation,reconcile_boost_moved_outside_persona04,"Guidance on Uncertified Visuals and Government Best Practices Option A: Use ""HTML Content (lite)"" (Certified) The developer of the HTML Content visual released a specific version for security-conscious environments. • Status: Microsoft Certified. • Capabilities: Renders HTML and SVG but blocks external resources (e.g., images hosted on the web) and dangerous script tags to comply with security rules. • Verdict: This is your primary ""drop-in"" replacement if your HTML does not require fetching external assets. Option B: Deneb (Certified) • Status: Microsoft Certified. • Capabilities: Allows you to build custom visuals using the Vega or Vega-Lite languages. It is extremely powerful and secure but has a steeper learning curve than HTML. • Verdict: Best for complex, custom charts where security is paramount. Option C: Native SVG Rendering (The ""Zero-Risk"" Workaround) You do not strictly need a custom visual to render HTML-like graphics. You can use standard DAX measures to generate SVG (Scalable Vector Graphics) code and display it inside the native Table or Matrix visuals. • How it works: 1. Write a DAX measure that outputs an SVG string (e.g., ... ). 2. Categorize the measure as ""Image URL"" . 3. Add the prefix data&colon;image/svg+xml;utf8, to your SVG string. • Security: This runs entirely within Power BI’s native rendering engine. No third-party code is involved. • Verdict: The most secure method for indicators, sparklines, and custom icons. 4. Recommended Governance Path If you absolutely must use the uncertified ""HTML Content"" visual (e.g., for specific functionality not present in the Lite version), follow these steps to maintain governance: 1. Code Audit: Your internal IT security team should audit the open-source code of the visual (available on GitHub). 2. Private Version: Fork the repository, sign it with your organization’s code-signing certificate, and package it as a private visual. 3. Deployment: Deploy this private version via the ""Organizational Visuals"" section in the Power BI Admin Portal. This allows you to ""bless"" this specific version for your users while keeping the global ""Block uncertified visuals"" setting enabled. If this suggestion works for you, kindly mark this reply as the solution and provide kudos . Mohit Singh | PL300 | DP600 | DP-700 https://www.linkedin.com/in/mohit-singh-16b917105 Option A: Use ""HTML Content (lite)"" (Certified) The developer of the HTML Content visual released a specific version for security-conscious environments. • Status: Microsoft Certified. • Capabilities: Renders HTML and SVG but blocks external resources (e.g., images hosted on the web) and dangerous script tags to comply with security rules. • Verdict: This is your primary ""drop-in"" replacement if your HTML does not require fetching external assets. Option B: Deneb (Certified) • Status: Microsoft Certified. • Capabilities: Allows you to build custom visuals using the Vega or Vega-Lite languages. It is extremely powerful and secure but has a steeper learning curve than HTML. • Verdict: Best for complex, custom charts where security is paramount. Option C: Native SVG Rendering (The ""Zero-Risk"" Workaround) You do not strictly need a custom visual to render HTML-like graphics. You can use standard DAX measures to generate SVG (Scalable Vector Graphics) code and display it inside the native Table or Matrix visuals. • How it works: 1. Write a DAX measure that outputs an SVG string (e.g., ... ). 2. Categorize the measure as ""Image URL"" . 3. Add the prefix data&colon;image/svg+xml;utf8, to your SVG string. • Security: This runs entirely within Power BI’s native rendering engine. No third-party code is involved. • Verdict: The most secure method for indicators, sparklines, and custom icons. 4. Recommended Governance Path If you absolutely must use the uncertified ""HTML Content"" visual (e.g., for specific functionality not present in the Lite version), follow these steps to maintain governance: 1. Code Audit: Your internal IT security team should audit the open-source code of the visual (available on GitHub). 2. Private Version: Fork the repository, sign it with your organization’s code-signing certificate, and package it as a private visual. 3. Deployment: Deploy this private version via the ""Organizational Visuals"" section in the Power BI Admin Portal. This allows you to ""bless"" this specific version for your users while keeping the global ""Block uncertified visuals"" setting enabled. If this suggestion works for you, kindly mark this reply as the solution and provide kudos . Mohit Singh | PL300 | DP600 | DP-700 https://www.linkedin.com/in/mohit-singh-16b917105",How can we validate and reconcile reported numbers with less manual QA?,general_friction,dashboard_update,P_TOOL_LIMITATION,Q_VALIDATE_NUMBERS,O_XLSX|O_DASHBOARD,automation,validate_numbers,tool_limitation,medium,expansion_positive_should_join_persona_04,Outside-persona_04 row was previously drawn toward reconciliation-like clustering and still matches persona_04 semantic profile.,medium_high,True,Strict outside-persona_04 reconciliation/signoff candidate chosen for expansion-gain simulation.,True,False,False,
power_bi_community::5146392::01,power_bi_community,https://community.fabric.microsoft.com/t5/Desktop/PBIP-file-type-is-different-when-being-saved-in-the-systems/td-p/5145915,persona_02,primary=metric_reconciliation||secondary=dashboard_mistrust|repeated_validation_before_sending|root_cause_analysis_difficulty,high_conf_validation_non_persona04,"PBIP file type is different when being saved in the systems. Hey @Someshwaran , More likely a File Explorer discrepancy than a Power BI one. Simply put, on one system, the File Explorer is able to pull in the friendly name associated with the file (""Microsoft Power BI Desktop Project"") and in the other it is not able to resolve the friendly name and hence it shows the technical name (could be due to one using Microsoft store downloaded Power BI or MSI installed Power BI, among other reasons). You can see the same thing happening for the .gitignore file's type as well. Bottom line: it's not an issue. Hope it helps! Hey @Someshwaran , More likely a File Explorer discrepancy than a Power BI one. Simply put, on one system, the File Explorer is able to pull in the friendly name associated with the file (""Microsoft Power BI Desktop Project"") and in the other it is not able to resolve the friendly name and hence it shows the technical name (could be due to one using Microsoft store downloaded Power BI or MSI installed Power BI, among other reasons). You can see the same thing happening for the .gitignore file's type as well. Bottom line: it's not an issue. Hope it helps!",How can we diagnose and resolve analytics issues faster?,general_friction,unspecified_output,P_DATA_QUALITY,Q_DIAGNOSE_ISSUE,O_XLSX,validation,diagnose_change,data_quality,medium,expansion_positive_should_join_persona_04,Outside-persona_04 row has strong validation/data-quality/trust signals and is suitable for expansion-gain testing.,medium_high,True,Strict outside-persona_04 reconciliation/signoff candidate chosen for expansion-gain simulation.,True,False,False,
power_bi_community::5147175::01,power_bi_community,https://community.fabric.microsoft.com/t5/Desktop/Date-Format-in-Data-View-differs-from-Report-View/td-p/3372431,persona_01,primary=manual_reporting||secondary=dashboard_mistrust|metric_reconciliation|recurring_export_work,reconcile_boost_moved_outside_persona04,"Date Format in Data View differs from Report View Hi @Florimond , If the data comes from Power Query Sometimes the issue originates there. Make sure that: The column is set to Date type, not Text You avoid automatic “Changed Type (Locale)” steps that may cause mismatches Check the column data type and format In Model view: Select the date column Confirm Data type = Date (not Text) Set the format explicitly (e.g. dd/MM/yyyy) Check model culture (very important) Go to: File → Options and settings → Options → Regional settings Set the Model language / locale to your required format (e.g. English (UK)) Then refresh the model Please mark this as solved if it resolves your issue. Hi @Florimond , If the data comes from Power Query Sometimes the issue originates there. Make sure that: The column is set to Date type, not Text You avoid automatic “Changed Type (Locale)” steps that may cause mismatches Check the column data type and format In Model view: Select the date column Confirm Data type = Date (not Text) Set the format explicitly (e.g. dd/MM/yyyy) Check model culture (very important) Go to: File → Options and settings → Options → Regional settings Set the Model language / locale to your required format (e.g. English (UK)) Then refresh the model Please mark this as solved if it resolves your issue.",How can we deliver recurring reporting output faster and with fewer manual steps?,data_quality,xlsx_report,P_DATA_QUALITY,Q_REPORT_SPEED,O_XLSX,reporting,report_speed,data_quality,medium,expansion_positive_should_join_persona_04,Outside-persona_04 row was previously drawn toward reconciliation-like clustering and still matches persona_04 semantic profile.,medium_high,True,Strict outside-persona_04 reconciliation/signoff candidate chosen for expansion-gain simulation.,True,False,False,
